{
  "version": "1.0",
  "assets": [
    {
      "id": "anim_scene_opener",
      "material_id": "scene_opener_mat",
      "layer": "background",
      "has_alpha": false,
      "type": "animation",
      "subtype": "generated",
      "path": "assets/video/scene_opener.mp4",
      "source_tool": "build_vertical.mjs",
      "scene_id": "scene_opener",
      "duration_seconds": 3.0,
      "resolution": "1080x1920",
      "format": "mp4",
      "seed": 20260827,
      "generation_summary": "Vertical 1080x1920 military-title-card render (title-only / data-viz), baked by build_vertical.mjs via hyperframes"
    },
    {
      "id": "anim_scene_section_01_1",
      "material_id": "scene_section_01_1_mat_bg",
      "layer": "background",
      "has_alpha": false,
      "type": "animation",
      "subtype": "generated",
      "path": "assets/video/scene_section_01_1.mp4",
      "source_tool": "build_vertical.mjs",
      "scene_id": "scene_section_01_1",
      "duration_seconds": 2.0,
      "resolution": "1080x1920",
      "format": "mp4",
      "seed": 20260827,
      "generation_summary": "Vertical 1080x1920 composite (Pexels photo bg + title/data-viz overlay baked), built by project-local build_vertical.mjs via hyperframes"
    },
    {
      "id": "anim_scene_section_01_2",
      "material_id": "scene_section_01_2_mat_bg",
      "layer": "background",
      "has_alpha": false,
      "type": "animation",
      "subtype": "generated",
      "path": "assets/video/scene_section_01_2.mp4",
      "source_tool": "build_vertical.mjs",
      "scene_id": "scene_section_01_2",
      "duration_seconds": 12.7,
      "resolution": "1080x1920",
      "format": "mp4",
      "seed": 20260827,
      "generation_summary": "Vertical 1080x1920 composite (Pexels photo bg + title/data-viz overlay baked), built by project-local build_vertical.mjs via hyperframes"
    },
    {
      "id": "anim_scene_section_01_3",
      "material_id": "scene_section_01_3_mat_bg",
      "layer": "background",
      "has_alpha": false,
      "type": "animation",
      "subtype": "generated",
      "path": "assets/video/scene_section_01_3.mp4",
      "source_tool": "build_vertical.mjs",
      "scene_id": "scene_section_01_3",
      "duration_seconds": 11.33,
      "resolution": "1080x1920",
      "format": "mp4",
      "seed": 20260827,
      "generation_summary": "Vertical 1080x1920 composite (Pexels photo bg + title/data-viz overlay baked), built by project-local build_vertical.mjs via hyperframes"
    },
    {
      "id": "anim_scene_section_02_1",
      "material_id": "scene_section_02_1_mat_bg",
      "layer": "background",
      "has_alpha": false,
      "type": "animation",
      "subtype": "generated",
      "path": "assets/video/scene_section_02_1.mp4",
      "source_tool": "build_vertical.mjs",
      "scene_id": "scene_section_02_1",
      "duration_seconds": 10.47,
      "resolution": "1080x1920",
      "format": "mp4",
      "seed": 20260827,
      "generation_summary": "Vertical 1080x1920 composite (Pexels photo bg + title/data-viz overlay baked), built by project-local build_vertical.mjs via hyperframes"
    },
    {
      "id": "anim_scene_section_02_2",
      "material_id": "scene_section_02_2_mat_bg",
      "layer": "background",
      "has_alpha": false,
      "type": "animation",
      "subtype": "generated",
      "path": "assets/video/scene_section_02_2.mp4",
      "source_tool": "build_vertical.mjs",
      "scene_id": "scene_section_02_2",
      "duration_seconds": 12.9,
      "resolution": "1080x1920",
      "format": "mp4",
      "seed": 20260827,
      "generation_summary": "Vertical 1080x1920 composite (Pexels photo bg + title/data-viz overlay baked), built by project-local build_vertical.mjs via hyperframes"
    },
    {
      "id": "anim_scene_section_02_3",
      "material_id": "scene_section_02_3_mat_bg",
      "layer": "background",
      "has_alpha": false,
      "type": "animation",
      "subtype": "generated",
      "path": "assets/video/scene_section_02_3.mp4",
      "source_tool": "build_vertical.mjs",
      "scene_id": "scene_section_02_3",
      "duration_seconds": 2.7,
      "resolution": "1080x1920",
      "format": "mp4",
      "seed": 20260827,
      "generation_summary": "Vertical 1080x1920 composite (Pexels photo bg + title/data-viz overlay baked), built by project-local build_vertical.mjs via hyperframes"
    },
    {
      "id": "anim_scene_section_03_1",
      "material_id": "scene_section_03_1_mat_bg",
      "layer": "background",
      "has_alpha": false,
      "type": "animation",
      "subtype": "generated",
      "path": "assets/video/scene_section_03_1.mp4",
      "source_tool": "build_vertical.mjs",
      "scene_id": "scene_section_03_1",
      "duration_seconds": 7.4,
      "resolution": "1080x1920",
      "format": "mp4",
      "seed": 20260827,
      "generation_summary": "Vertical 1080x1920 composite (Pexels photo bg + title/data-viz overlay baked), built by project-local build_vertical.mjs via hyperframes"
    },
    {
      "id": "anim_scene_section_03_2",
      "material_id": "scene_section_03_2_mat_bg",
      "layer": "background",
      "has_alpha": false,
      "type": "animation",
      "subtype": "generated",
      "path": "assets/video/scene_section_03_2.mp4",
      "source_tool": "build_vertical.mjs",
      "scene_id": "scene_section_03_2",
      "duration_seconds": 8.8,
      "resolution": "1080x1920",
      "format": "mp4",
      "seed": 20260827,
      "generation_summary": "Vertical 1080x1920 composite (Pexels photo bg + title/data-viz overlay baked), built by project-local build_vertical.mjs via hyperframes"
    },
    {
      "id": "anim_scene_section_03_3",
      "material_id": "scene_section_03_3_mat_bg",
      "layer": "background",
      "has_alpha": false,
      "type": "animation",
      "subtype": "generated",
      "path": "assets/video/scene_section_03_3.mp4",
      "source_tool": "build_vertical.mjs",
      "scene_id": "scene_section_03_3",
      "duration_seconds": 5.6,
      "resolution": "1080x1920",
      "format": "mp4",
      "seed": 20260827,
      "generation_summary": "Vertical 1080x1920 composite (Pexels photo bg + title/data-viz overlay baked), built by project-local build_vertical.mjs via hyperframes"
    },
    {
      "id": "anim_scene_section_04_1",
      "material_id": "scene_section_04_1_mat_bg",
      "layer": "background",
      "has_alpha": false,
      "type": "animation",
      "subtype": "generated",
      "path": "assets/video/scene_section_04_1.mp4",
      "source_tool": "build_vertical.mjs",
      "scene_id": "scene_section_04_1",
      "duration_seconds": 5.13,
      "resolution": "1080x1920",
      "format": "mp4",
      "seed": 20260827,
      "generation_summary": "Vertical 1080x1920 composite (Pexels photo bg + title/data-viz overlay baked), built by project-local build_vertical.mjs via hyperframes"
    },
    {
      "id": "anim_scene_section_04_2",
      "material_id": "scene_section_04_2_mat_bg",
      "layer": "background",
      "has_alpha": false,
      "type": "animation",
      "subtype": "generated",
      "path": "assets/video/scene_section_04_2.mp4",
      "source_tool": "build_vertical.mjs",
      "scene_id": "scene_section_04_2",
      "duration_seconds": 5.33,
      "resolution": "1080x1920",
      "format": "mp4",
      "seed": 20260827,
      "generation_summary": "Vertical 1080x1920 composite (Pexels photo bg + title/data-viz overlay baked), built by project-local build_vertical.mjs via hyperframes"
    },
    {
      "id": "anim_scene_section_04_3",
      "material_id": "scene_section_04_3_mat_bg",
      "layer": "background",
      "has_alpha": false,
      "type": "animation",
      "subtype": "generated",
      "path": "assets/video/scene_section_04_3.mp4",
      "source_tool": "build_vertical.mjs",
      "scene_id": "scene_section_04_3",
      "duration_seconds": 2.7,
      "resolution": "1080x1920",
      "format": "mp4",
      "seed": 20260827,
      "generation_summary": "Vertical 1080x1920 composite (Pexels photo bg + title/data-viz overlay baked), built by project-local build_vertical.mjs via hyperframes"
    },
    {
      "id": "anim_scene_section_05_1",
      "material_id": "scene_section_05_1_mat_bg",
      "layer": "background",
      "has_alpha": false,
      "type": "animation",
      "subtype": "generated",
      "path": "assets/video/scene_section_05_1.mp4",
      "source_tool": "build_vertical.mjs",
      "scene_id": "scene_section_05_1",
      "duration_seconds": 7.1,
      "resolution": "1080x1920",
      "format": "mp4",
      "seed": 20260827,
      "generation_summary": "Vertical 1080x1920 composite (Pexels photo bg + title/data-viz overlay baked), built by project-local build_vertical.mjs via hyperframes"
    },
    {
      "id": "anim_scene_section_05_2",
      "material_id": "scene_section_05_2_mat_bg",
      "layer": "background",
      "has_alpha": false,
      "type": "animation",
      "subtype": "generated",
      "path": "assets/video/scene_section_05_2.mp4",
      "source_tool": "build_vertical.mjs",
      "scene_id": "scene_section_05_2",
      "duration_seconds": 5.8,
      "resolution": "1080x1920",
      "format": "mp4",
      "seed": 20260827,
      "generation_summary": "Vertical 1080x1920 composite (Pexels photo bg + title/data-viz overlay baked), built by project-local build_vertical.mjs via hyperframes"
    },
    {
      "id": "anim_scene_section_06_1",
      "material_id": "scene_section_06_1_mat_bg",
      "layer": "background",
      "has_alpha": false,
      "type": "animation",
      "subtype": "generated",
      "path": "assets/video/scene_section_06_1.mp4",
      "source_tool": "build_vertical.mjs",
      "scene_id": "scene_section_06_1",
      "duration_seconds": 10.47,
      "resolution": "1080x1920",
      "format": "mp4",
      "seed": 20260827,